apply_cnt,city,cn_remark,company_desc,company_detail,company_license,company_name,contact_email,contact_name,contact_phone,country,creator,currency,desc,edu_level,email,entity_type,entry_type,expire_time,ext_info,fb_share_cnt,fev_cnt,hiring_count,industry,job_benefits,max_salary,min_salary,mobile,name,position,publish_time,register_add,remark,salary_type,skills,src_url,status,sys_tags,tags,tax_id_no,view_cnt,website,work_addr,work_time_end,work_time_start,work_type,workday,zalo_share_cnt
,2,,,"{""src_url"": ""https://www.vietnamworks.com/hn-khoi-cntt-lap-trinh-vien-java-1251854-jd"", ""remark"": """", ""cn_remark"": """", ""ext_info"": """", ""company_desc"": ""Ngân hàng Thương mại Cổ phần Bưu điện Liên Việt (LienVietPostBank) tiền thân là Ngân hàng Thương mại Cổ phần Liên Việt (LienVietBank) được thành lập theo Giấy phép thành lập và hoạt động số 91/GP-NHNN ngày 28/03/2008 của Thống đốc Ngân hàng Nhà nước Việt Nam.<br>\n<br>\nHiện nay, với số vốn điều lệ hơn 9769 tỷ đồng và mạng lưới phủ khắp toàn quốc, LienVietPostBank là một trong các Ngân hàng Thương mại cổ phần lớn nhất Việt Nam. Với nền tảng công nghệ hiện đại, tiềm lực tài chính vững mạnh và đội ngũ nhân sự chuyên nghiệp, giàu kinh nghiệm chuyên môn cùng với tinh thần nhiệt huyết, LienVietPostBank đang trên con đường xây dựng để trở thành Ngân hàng Thương mại cổ phần hàng đầu và hướng tới phát triển thành một tập đoàn Dịch vụ Tài chính – Ngân hàng lớn mạnh của Việt Nam.<br>\n<br>\nLienVietPostBank luôn coi nguồn nhân lực là yếu tố cốt lõi và là tài sản quý giá của Ngân hàng. Vì vậy, LienVietPostBank không chỉ đảm bảo một công việc mà cao hơn là một sự nghiệp với những ai đến với Ngân hàng bằng tinh thần học hỏi, tinh thần phấn đấu xây dựng và nỗ lực cống hiến.<br>"", ""company_name"": ""NGÂN HÀNG THƯƠNG MẠI CỔ PHẦN BƯU ĐIỆN LIÊN VIỆT (LIENVIETPOST BANK)"", ""company_license"": """", ""tax_id_no"": """", ""register_add"": """", ""work_addr"": ""Tòa nhà Capital Tower, số 109, Trần Hưng Đạo, Quận Hoàn Kiếm, Hà Nội"", ""mobile"": """", ""website"": """", ""email"": """", ""entity_type"": 0, ""country"": ""VN"", ""city"": """", ""industry"": ""IT - Software||Banking||IT - Hardware/Networking||""}",,,,Phòng Nhân sự,,VN,,USD,"1. Thực hiện công việc của phòng<br>-       Thực hiện xây dựng, phát triển sản phẩm trên hệ thống Quản trị doanh nghiệp thực hiện theo yêu cầu nghiệp vụ.<br>-       Phát triển mới các phương thức/ tính năng giao dịch điện tử và thanh toán điện tử trên các kênh giao dịch trực tuyến.<br>-       Thực hiện tích hợp kỹ thuật với các hệ thống CNTT trong nội bộ Ngân hàng và các đối tác cung cấp dịch vụ bên ngoài để khai thác các tiện ích/ dịch vụ mà các hệ thống này cung cấp.<br>-       Thực hiện kiểm thử unit test và phối hợp test/ sửa lỗi với các bên liên quan.<br>-       Lập tài liệu kỹ thuật, chuyển giao ứng dụng cho các Đơn vị Hỗ trợ nghiệp vụ và Quản trị vận hành và khai thác.<br>-       Quản lý, rà soát, đối chiếu code trước khi đưa lên môi trường UAT, LIVE.<br>-       Phối hợp đưa ứng dụng lên môi trường LIVE.<br>-       Hỗ trợ các đơn vị trong quá trình vận hành ứng dụng.<br>-       Kiểm tra và khắc phục lỗi khi có yêu cầu từ phía nghiệp vụ và các đơn vị kinh doanh.<br><br>2. Công việc khác<br>-       Góp phần xây dựng môi trường làm việc hiệu quả, thân thiện trong nội bộ Ban, Phòng, Khối<br>-       Thực hiện các nhiệm vụ khác theo yêu cầu của lãnh đạo Phòng/ Khối<br>-       Tuân thủ quy định, quy chế của Ngân hàng và Khối ban hành.<br>",0,,,2,2020-05-22 00:00:00,,,,,IT - Software||Banking||IT - Hardware/Networking||,<br><br>,2000,900,,[HN] Khối CNTT - Lập Trình Viên Java,,1589731200,,,1,"-       Tốt nghiệp Cao đẳng/Đại học trở lên, chuyên ngành: Công nghệ thông tin, Toán tin, Công nghệ phần mềm<br>-       Không yêu cầu kinh nghiệm làm việc<br>-       Có kiến thức công nghệ thông tin và nghiệp vụ ngân hàng<br>-       Có kiến thức về lập trình ứng dụng và webservice. Sử dụng thành thạo một trong các ngôn ngữ lập trình  Java, PL/SQL<br>-       Có kiến thức về cơ sở dữ liệu Oracle, SQL Server, My SQL,…<br>-       Có khả năng làm việc với các nền tảng/ ứng dụngSharePoint, ESB, PeopleSoft, Web server, …<br>",https://www.vietnamworks.com/hn-khoi-cntt-lap-trinh-vien-java-1251854-jd,,,,,,,,,,1,,
,1,,,"{""src_url"": ""https://www.vietnamworks.com/it-sub-leader-java-japanese-n3-1258453-jd"", ""remark"": """", ""cn_remark"": """", ""ext_info"": """", ""company_desc"": ""Our client is a Japanese Company<br>"", ""company_name"": ""NAVIGOS SEARCH'S CLIENT"", ""company_license"": """", ""tax_id_no"": """", ""register_add"": """", ""work_addr"": ""HCMC"", ""mobile"": """", ""website"": """", ""email"": """", ""entity_type"": 0, ""country"": ""VN"", ""city"": """", ""industry"": ""IT - Software||""}",,,,Ha Phan,,VN,,USD,● Communicate with Japanese parent company<br>● Understand the project and suggest the development way<br>● Support team leader for project management<br>● Schedule & resource management<br>● Reporting to JP side<br>Requirements<br>,0,,,2,2020-06-27 00:00:00,,,,,IT - Software||,<br><br>,1400,1200,,"IT Sub-Leader (Java, Japanese N3)",,1591286400,,,1,"● At least 2-5 years of Java developer experience<br>● N3- N2 Japanese communication skill – certificate is not required<br><br>[Nice to have]<br>● Understanding of MD wear<br>● English<br>● Used languages: Java/J2EE,Javascript, CSS, HTML . Framework: Struts, Spring.Java Core, Junit, J2EE<br>● DB: Oracle, MySQL, PostgreSQL, SQL Server<br><br>Benefits<br>● Working time: 8:00 - 17:30 (lunch 1.5 hours), Mon - Fri<br>● 13th month salary<br>● Performance bonus: once a year depending on company benefit & individual performance<br>● Holidays: 12dasy paid + VN national holiday  + Special holidays (=JP national holiday - VN national holiday)<br>● Company trip : once a year (Danang in 2019)<br>● Other benefit following Vietnam labor law<br>",https://www.vietnamworks.com/it-sub-leader-java-japanese-n3-1258453-jd,,,,,,,,,,1,,
,1,,,"{""src_url"": ""https://www.vietnamworks.com/hcm-web-developers-javascript-nodejs-php-attractive-salary-1-1-2-1261052-jd"", ""remark"": """", ""cn_remark"": """", ""ext_info"": """", ""company_desc"": ""The first office is in HCM City from Nov 2013, until now Bluecom in Ho Chi Minh City has more than 200 official staffs. From 2017, Bluecom becomes Isobar Commerce, a part of Isobar Global Group. With the needs of expansion, we are looking for qualified candidates to participate into our outsourcing project coming from Europe, Australia, China, etc<br>\r\n<br>\r\nWith expertise in either B2C or B2B e-commerce, we are working with scalable, reliable, secure and renowned frameworks like : Magento, Demandware and Hybris<br>\r\n<br>\r\n- Present in Shanghai, Hong Kong, Japan and Ho Chi Minh City<br>\r\n- Magento Gold partner<br>\r\n- Hybris Silver partner<br>\r\n- Demandware Associate <br>\r\n<br>\r\nAdress :<br>\r\n<br>\r\nHa Noi City : Unit 904, 9th Floor, Indochina Plaza Hanoi Building, 241 Xuan Thuy St., Cau Giay District, Hanoi, VIETNAM<br>\r\nHCM City : 7/F Scetpa Building, 19A Cong Hoa, Tan Binh Dist, HCMC<br>"", ""company_name"": ""ISOBAR COMMERCE ( BLUECOM SOLUTIONS)"", ""company_license"": """", ""tax_id_no"": """", ""register_add"": """", ""work_addr"": ""7/F Scetpa Building, 19A Cong Hoa, Tan Binh Dist, HCMC"", ""mobile"": """", ""website"": """", ""email"": """", ""entity_type"": 0, ""country"": ""VN"", ""city"": """", ""industry"": ""IT - Software||IT - Hardware/Networking||Internet/Online Media||""}",,,,HR Dept.,,VN,,USD,"We are seeking potential developers who are motivated and dedicated web developers to work on outsourcing various e-commerce projects for well-known brands (Sony, Bossini, Samsonite, Lacoste, Pandora…). You will be a master on Salesforce Commerce Cloud (Demandware), a leading SaaS eCommerce system. You will work under the supervision of Project Manager and in collaboration with the other members of the team with the job description as below:<br>• Develop dynamic enhanced e-commerce web experiences<br>• Develop customer-specific web-based applications, systems integrations and custom application development.<br>• Contribute to the success of the platform by deliver plugins, extensions, and pre-built packages to the market.<br>• Apply technical skills in both front and back-end environments<br>",0,,,2,2020-07-11 00:00:00,,,,,IT - Software||IT - Hardware/Networking||Internet/Online Media||,<br><br><br><br>,,,,"(HCM) Web Developers ( Javascript, Nodejs, PHP) | Attractive Salary",,1591891200,,,1,"• Previous experience in web development with any of JavaScript/ Node.js/ ASP.NET/ C#/ C++/ Java/ PHP etc.<br>• Experience with Javascript ES5 or ES6 is a strong plus.<br>• Proficiency in industry standards, such as Web Services, Ajax, JSON, JavaScript/jQuery, and XML.<br>• Experience with MVC and Object Oriented Programming concepts<br>• Good understanding of basic ecommerce concepts.<br>• Working knowledge of version control systems (experience with Git a plus)<br>• Self-motived, with a focused disposition and a positive outlook<br>• Great communicator with good interpersonal skills and the ability to communicate effectively at both a business and technical level.<br>",https://www.vietnamworks.com/hcm-web-developers-javascript-nodejs-php-attractive-salary-1-1-2-1261052-jd,,,,,,,,,,1,,
,2,,,"{""src_url"": ""https://www.vietnamworks.com/hot-job-team-lead-java-1254629-jd"", ""remark"": """", ""cn_remark"": """", ""ext_info"": """", ""company_desc"": ""ASCEND Group ( ASCEND Technology)<br>\r\n<br>\r\nASCEND Technology is under Thailand’s Ascend Group. We are SEA's leading fintech brand, providing ePayment services that help facilitate everyday transactional needs with offices in Vietnam, Cambodia, Myanmar, Indonesia and the Philippines. We are the world's only ePayment brand with licenses to operate eMoney in almost every SEA country. Our platform includes TrueMoney Wallet, WeCard by MasterCard, TrueMoney CashCard, Kiosk, Express, Payment Gateway and Remittance. <br>\r\n<br>\r\nOur company website  <br>\r\n<br>\r\nOur memeber company website<br>\r\n- TrueMoney Vietnam: www.truemoney.com.vn <br>\r\n- TrueMoney Cambodia:  <br>\r\n- TrueMoney Myanmar:  <br>\r\n- TrueMoney Philippines:  <br>\r\n- TrueMoney Indonesia:  <br>\r\n- TrueMoney Thailand: <br>"", ""company_name"": ""ASCEND GROUP ( ASCEND TECHNOLOGY)"", ""company_license"": """", ""tax_id_no"": """", ""register_add"": """", ""work_addr"": ""11th & 12th floor, Song Hong Land Building, 165 Thai Ha Str., Dong Da Dist., Hanoi"", ""mobile"": """", ""website"": """", ""email"": """", ""entity_type"": 0, ""country"": ""VN"", ""city"": """", ""industry"": ""IT - Software||IT - Hardware/Networking||""}",,,,Phòng Nhân Sự,,VN,,USD,"- Team management:<br>Be the contact point with stake holders to clarify the requirement and estimation<br>Manage and overview the progress<br>Give solution when issues arise<br><br>- Technical:<br>Work in development team to help team complete task of developing product.<br>Design system based on the industry best practice<br>Create test cases, develop unit test program, running unit test, and create unit test report<br>Design system based on the industry best practice<br>",0,,,2,2020-06-07 00:00:00,,,,,IT - Software||IT - Hardware/Networking||,<br><br><br><br>,,,,[HOT JOB] Team-Lead Java,,1590422400,,,1,"- Strong in Java (Springboot,...)<br>- Good DB skill<br>- Experience with API (Open API/ Swagger)<br>- Good English in verbal and writing<br>- Experience in Scrum process especially with Team-Lead position<br><br>WHY YOU'LL LOVE WORKING HERE:<br>• Office hours: Monday- Friday, off on Saturday and Sunday, flexible working-time and remote-working policy<br>• Competitive remuneration package<br>• 12 annual leaves plus 10 full paid sick leaves with lunch allowance<br>• Healthcare insurance package (Bao Viet insurance)<br>• 13th salary + year end performance bonus<br>• Social insurance, health insurance and unemployment insurance will be under Labor Law<br>• Standard Agile Scrum with latest updated technology from USA<br>• Unlimited access to Udemy training course<br>• Free English and Technical training course with knowledge-sharing allowance<br>• Mac-book is provided for work<br>• Annual summer vacation, Team-building activities along with occasional allowance as Newborn, Wedding, Birthday, Mid-Autumn Festival,...<br>• Global and Dynamic working environment<br>• Professional development and abroad opportunities with clear career path<br>• Cooperating with many domestic and multi-national partners.<br>",https://www.vietnamworks.com/hot-job-team-lead-java-1254629-jd,,,,,,,,,,1,,
,17,,,"{""src_url"": ""https://www.vietnamworks.com/lap-trinh-java-18-1-1-1256807-jd"", ""remark"": """", ""cn_remark"": """", ""ext_info"": """", ""company_desc"": ""Tập đoàn Bưu chính Viễn thông Việt Nam (VNPT) - Nhà cung cấp dịch vụ viễn thông, dịch vụ số hàng đầu Việt Nam - Tập đoàn có danh tiếng về khả năng lãnh đạo, đổi mới chuyên môn xuất sắc. Nhân viên của chúng tôi sử dụng sự sáng tạo và tài năng để phát minh ra những giải pháp mới, đáp ứng nhu cầu mới và cung cấp sản phẩm/dịch vụvụ hiệu quả nhất trong ngành. Với hơn 70 năm xây dựng và phát triển gắn bó trên thị trường Viễn thông Việt NamNam, với 63 tỉnh thành có mạng lưới di động phủ sóng: hơn 20 triệu thuê bao di động, 11 triệu thuê bao băng rộng cố định, 10 triệu thuê bao điện thoại cố định<br>\n<br>\nVNPT đặt mục tiêu trở thành nhà cung cấp dịch vụ số hàng đầu Việt Nam và trung tâm dịch vụ Số (Digital Hub) của Châu Á trong những năm tới, để đạt được mục tiêu đó VNPT chuyển dịch nhanh cơ cấu doanh thu từ các dịch vụ viễn thông truyền thống sang dịch vụ số, Công nghệ thông tin<br>\n<br>\nVNPT đặt mục tiêu làm nòng cốt để ngành viễn thông và công nghệ thông tin tại Việt Nam phát triển nhanh và bền vững, cạnh tranh và hội nhập kinh tế Quốc tế có hiệu quả<br>"", ""company_name"": ""TẬP ĐOÀN BƯU CHÍNH VIỄN THÔNG VIỆT NAM (VNPT)"", ""company_license"": """", ""tax_id_no"": """", ""register_add"": """", ""work_addr"": ""Số 57 phố Huỳnh Thúc Kháng, Phường Láng Hạ, Quận Đống Đa, Thành phố Hà Nội"", ""mobile"": """", ""website"": """", ""email"": """", ""entity_type"": 0, ""country"": ""VN"", ""city"": """", ""industry"": ""IT - Software||""}",,,,Nhóm tuyển dụng,,VN,,USD,"- Lập trình viên Java Web trên nền Framework của VNPT IT (java, jsp, java script,html).<br>- Tham gia phát triển,bảo trì,triển khai phần mềm quản trị doanh nghiệp, giải pháp y tế, chính quyền điện tử<br>- Đọc hiểu các tài liệu mô tả yêu cầu người dùng (URD, SRS).<br>- Trực tiếp làm BA khảo sát nghiệp vụ khi cần thiết.<br>- Tham gia thiết kế và viết các tài liệu thiết kế chi tiết (SAD, SDD)<br>- Phối hợp với thành viên nhóm dự án, nhóm QA, Test, khách hàng triển khai dự án<br>- Xây dựng kế hoạch công việc, báo cáo, đánh giá công việc của cá nhân, đóng góp các sáng kiến nâng cao chất lượng, năng suất công việc<br>",0,,,2,2020-06-19 00:00:00,,,,,IT - Software||,<br><br><br><br>,1500,800,,Lập Trình Java,,1590940800,,,1,"- Tốt nghiệp ĐH chính quy chuyên ngành CNTT hoặc các ngành liên quan<br>- Có khả năng thành thạo lập trình Java EE, JSP, java script, html; Sping Framework ;<br>- Biết sử dụng thành thạo ít nhất một công cụ lập trình thông dụng: Visual Studio, Eclipse,Netbean,…<br>- Hiểu biết về web server như IIS, Apache Tomcat, Jboss,..<br>- Hiểu biết về CSDL (SQL, MySQL, Oracle) và sử dụng thành thạo các câu lệnh truy vấn PL/SQL.<br>- Có khả năng tiếp cận ngôn ngữ lập trình mới nhanh. Khả năng nghiên cứu, giải quyết vấn đề tốt và kiểm soát công việc, thời gian theo đúng tiến độ.<br>- Có khả năng làm việc với cường độ cao, khả năng nghiên cứu tốt. Say mê công việc.<br>- Có khả năng làm độc lập hoặc làm việc theo nhóm.<br>*Ưu tiên:<br>+ Có từ 3 năm kinh nghiệm lập trình Java EE, JSP, java script,html; Sping Framework ; PL/SQL Oracle , có hiểu biết về nghiệp vụ quản trị doanh nghiệp.<br>+ Có kinh nghiệm tham gia các dự án CNTT với nhiều vai trò: BA, dev<br>+ Có kinh nghiệp lập trình sản phẩm xử lý nhiều về nghiệp vụ.<br>+ Có kinh nghiệp lập trình hệ thống Quản lý văn bản, hệ thống quản lý quy trình nghiệp vụ BPM - Activity.<br>",https://www.vietnamworks.com/lap-trinh-java-18-1-1-1256807-jd,,,,,,,,,,1,,
,17,,,"{""src_url"": ""https://www.vietnamworks.com/200-fresher-php-java-net-python-ai-big-data-blockchain-tester-automation-tester-1-1-1-1-1-1-1-1-1-1-1-1-1-1256789-jd"", ""remark"": """", ""cn_remark"": """", ""ext_info"": """", ""company_desc"": ""Tập đoàn Bưu chính Viễn thông Việt Nam (VNPT) - Nhà cung cấp dịch vụ viễn thông, dịch vụ số hàng đầu Việt Nam - Tập đoàn có danh tiếng về khả năng lãnh đạo, đổi mới chuyên môn xuất sắc. Nhân viên của chúng tôi sử dụng sự sáng tạo và tài năng để phát minh ra những giải pháp mới, đáp ứng nhu cầu mới và cung cấp sản phẩm/dịch vụvụ hiệu quả nhất trong ngành. Với hơn 70 năm xây dựng và phát triển gắn bó trên thị trường Viễn thông Việt NamNam, với 63 tỉnh thành có mạng lưới di động phủ sóng: hơn 20 triệu thuê bao di động, 11 triệu thuê bao băng rộng cố định, 10 triệu thuê bao điện thoại cố định<br>\n<br>\nVNPT đặt mục tiêu trở thành nhà cung cấp dịch vụ số hàng đầu Việt Nam  và trung tâm dịch vụ Số (Digital Hub) của Châu Á trong những năm tới, để đạt được mục tiêu đó VNPT chuyển dịch nhanh cơ cấu doanh thu từ các dịch vụ viễn thông truyền thống sang dịch vụ số, Công nghệ thông tin<br>\n<br>\nVNPT đặt mục tiêu làm nòng cốt để ngành viễn thông và công nghệ thông tin tại Việt Nam phát triển nhanh và bền vững, cạnh tranh và hội nhập kinh tế Quốc tế có hiệu quả<br>"", ""company_name"": ""TẬP ĐOÀN BƯU CHÍNH VIỄN THÔNG VIỆT NAM (VNPT)"", ""company_license"": """", ""tax_id_no"": """", ""register_add"": """", ""work_addr"": ""Số 57 phố Huỳnh Thúc Kháng, Phường Láng Hạ, Quận Đống Đa, Thành phố Hà Nội"", ""mobile"": """", ""website"": """", ""email"": """", ""entity_type"": 0, ""country"": ""VN"", ""city"": """", ""industry"": ""IT - Software||IT - Hardware/Networking||""}",,,,Nhóm tuyển dụng,,VN,,USD,"Tuyển dụng tại: Hà Nội, HCM, Đà Nẵng, Hải Phòng, Tiền Giang<br><br>Là chương trình tuyển dụng Thực tập sinh/ Fresher lớn nhất tại VNPT- IT được tổ chức thường niên dành cho các bạn sinh viên khối ngành CNTT tại Hà Nội, TP. HCM, Hải Phòng, Đà Nẵng, Tiền Giang.<br><br>Năm nay, VNPT- IT FRESHER 2019 trở lại với mong muốn sẽ đem đến cho các bạn cơ hội “khám phá” và “phát triển” trong môi trường năng động và đầy thử thách với những:<br>",0,,,2,2020-06-19 00:00:00,,,,,IT - Software||IT - Hardware/Networking||,<br><br><br><br>,500,200,,"200 Fresher (PHP, Java, .Net, Python, Ai/big Data/blockchain,tester/automation Tester)",,1590940800,,,1,"* YÊU CẦU: (Ứng viên scan bằng cấp, bảng điểm vào CV ứng tuyển )<br>- Không yêu cầu kinh nghiệm<br>- Sinh viên năm cuối/cận cuối chuyên ngành CNTT hoặc Điện tử viễn thông các trường Đại học<br>Sinh viên đã tốt nghiệp không quá 1 năm<br>- GPA trung bình >= 2.5/4.0<br>- Nắm chắc kiến thức nền tảng về một trong các ngôn ngữ lập trình đã được học.<br>- Tư duy, logic rõ ràng.<br>- Có khả năng học hỏi nhanh, tinh thần cầu tiến.<br><br>* QUYỀN LỢI:<br>- Nhận lương lên đến 10tr/tháng tùy vị trí công việc ngay từ thời gian đào tạo (đối với Fresher)<br>- Tham gia miễn phí các khóa đào tạo kỹ năng mềm & lập trình<br>- Tham gia hỗ trợ phát triển các sản phẩm với hàng chục triệu người dùng.<br>- Được tư vấn & định hướng nghề nghiệp từ các Mentors- những chuyên gia hàng đầu trong lĩnh vực CNTT.<br>- Cơ hội được tuyển dụng chính thức tại VNPT- IT sau đào tạo.<br>",https://www.vietnamworks.com/200-fresher-php-java-net-python-ai-big-data-blockchain-tester-automation-tester-1-1-1-1-1-1-1-1-1-1-1-1-1-1256789-jd,,,,,,,,,,1,,
