apply_cnt,city,cn_remark,company_desc,company_detail,company_license,company_name,contact_email,contact_name,contact_phone,country,creator,currency,desc,edu_level,email,entity_type,entry_type,expire_time,ext_info,fb_share_cnt,fev_cnt,hiring_count,industry,job_benefits,max_salary,min_salary,mobile,name,position,publish_time,register_add,remark,salary_type,skills,src_url,status,sys_tags,tags,tax_id_no,view_cnt,website,work_addr,work_time_end,work_time_start,work_type,workday,zalo_share_cnt
,2,,,"{""src_url"": ""https://www.vietnamworks.com/team-leader-front-end-back-end-1253378-jd"", ""remark"": """", ""cn_remark"": """", ""ext_info"": """", ""company_desc"": ""We are also a member of NTT DATA Corporation, with business operations in 42 countries. Originally part of NTT Group. <br>\n<br>\nNTT DATA Vietnam Co., Ltd. was established in 2008 and is a leading company in IT solutions in software and Web applications, which is also major in technology research, consultancy, and transferring in IT with more than 190 employees in Vietnam. <br>\n<br>\nNTT DATA Vietnam is looking for qualified candidates in an attempt to broaden business. If you are talent in software development and now looking for a job with:<br>\n• Development Standard and Process<br>\n• Training/Growth Opportunity<br>\n• Quality Work Life/Good Benefit<br>\n• Health Insurance/Provident Funds<br>\n<br>\nHurry up to send your CV to us.<br>\n<br>\nFor further information, refer to www.nttdata.com and <br>"", ""company_name"": ""NTT DATA VIETNAM CO., LTD"", ""company_license"": """", ""tax_id_no"": """", ""register_add"": """", ""work_addr"": ""R202, HITC Building, 239 Xuan Thuy Street, Cau Giay District, Hanoi"", ""mobile"": """", ""website"": """", ""email"": """", ""entity_type"": 0, ""country"": ""VN"", ""city"": """", ""industry"": ""IT - Software||""}",,,,Ms. Nguyen Thi Quynh Nga/ Mr.Nguyen Duy Khanh/ Ms. Pham Thi Viet Anh,,VN,,USD,"•	Communicate with customer in requirement collection, progress reporting and trouble solving.<br>•	Transform customer’s requirements into logical, economical and practical system designs.<br>•	Analyze and design system flow and procedures to ensure optimum control and security of data and efficient use of resources.<br>•	Prepare detailed specifications from which complete sets of programs will be written.<br>•	Perform the role of Quality Control at each phase of development process.<br>•	Make WBS and detailed schedule for project’s development scope.<br>•	Monitor and ensure actual progress meeting the project plan.<br>•	Lead in researching and coaching new technology for growing up subordinates’ development skill.<br>•	Lead team 3~ 5 members<br>•	Report to Leader and Line Manager.<br>",0,,,2,2020-05-30 00:00:00,,,,,IT - Software||,<br><br><br><br>,,,,Team Leader (Front-End/back-End),,1590076800,,,1,"•	Bachelor’s Degree in Software Engineering, Computer Science or any other IT-related fields.<br>•	Master .NET and/or Java programming language.<br>•	Strong background in Database Processing.<br>•	Understand well in Software Development Processes.<br>•	Understand Design Document in Japanese language.<br>•	Good design documentation is required.<br>•	Japanese N3 level or above.<br>•	Knowledge in Informatica is an advantage.<br><br>* Benefits for successful candidates:<br><br>1. Salary: Competitive<br>2. Beside NET salary, employee will get the bonus 2 times per year according to working performance periodically and company profit.<br>3. Salary increment: 1 time per year.<br>4. Have Premium Health Care insurance package for yourself and your family.<br>5. Take annual leave 16 days per year.<br>6. Support IT and Business Manner courses.<br>7. Work off on Saturday and Sunday by weekly, public holidays according to Vietnam labor Law.<br>8. Company retreat: 1 time per year.<br>9. Professional working conditions.<br>10. Have a chance to work and study in Japan, APAC, India etc.<br>",https://www.vietnamworks.com/team-leader-front-end-back-end-1253378-jd,,,,,,,,,,1,,
,17,,,"{""src_url"": ""https://www.vietnamworks.com/technical-consultant-java-javascript-1-1258326-jd"", ""remark"": """", ""cn_remark"": """", ""ext_info"": """", ""company_desc"": ""mgm has been developing web applications for 25 years: eCommerce (online shops), Insurance and eGovernment. More than 700 colleagues in our 15 offices in Germany, France, Czech Republic, USA, Switzerland and Vietnam represent our vision: Innovation Implemented.<br>\n<br>\nmgm established their first development office in Da Nang in 2015 and opened their second office in late 2017, employing approximately 100 Vietnamese software engineers and is still expanding. Come and join us!<br>\n<br>\nWhy will you love working here?<br>\n•\t16 days of holiday allowance per year (on top of public holidays like Tet)<br>\n•\tFlexible working time (40h/week)<br>\n•\tHighly professional equipment (own laptop, 2-3 screens, adjustable desks)<br>\n•\tIntense English course for the first 3 months<br>\n•\tOptional English seminars during the work time<br>\n•\tPremium health insurance for you and your spouse (husband or wife)<br>\n•\tMonthly company dinners and team building covered by mgm<br>\n•\tAnnual company trips like Halong Bay, Phong Nha caves, etc.<br>\n•\tTET Bonus at the end of each calendar year<br>\n•       Free in-house entertainment facilities (darts, piano, climbing wall), drinks (coffee, beer, soft drinks,…) and food (cookies, fruit,…) and out-house company-funded sport clubs (football, swimming, badminton).<br>"", ""company_name"": ""MGM TECHNOLOGY PARTNERS"", ""company_license"": """", ""tax_id_no"": """", ""register_add"": """", ""work_addr"": ""mgm technology partners Vietnam, 7 Pasteur, Đà Nẵng"", ""mobile"": """", ""website"": """", ""email"": """", ""entity_type"": 0, ""country"": ""VN"", ""city"": """", ""industry"": ""IT - Software||IT - Hardware/Networking||High Technology||""}",,,,Khue Le (Ms.),,VN,,USD,"Job Description:<br><br>As a member of the A12 Technical Professional Services team, you will support the development team of projects using the A12 platform through their life cycle. You will:<br>• understand all A12 products, their architecture and underlying technologies<br>• collaborate with part of the Development team and the Business Professional Services team (which focuses on business experts rather than developers). Our colleagues are from Germany, France, the Czech Republic and the US<br>• initiate projects<br>• support pitches and proposals by developing customer-focused showcases<br>• be responsible for, support platform upgrades in, and consolidate requirements across customer projects<br>• add to developer-oriented training material and tutorials (text, videos, etc)<br>• help ramping up project teams by briefing and training them, sometimes also by contributing code<br>• relay information about project milestones, requirements, dependencies and problems to the team<br>• coordinate patch releases driven by problems of individual projects<br>• play an active role in all our communication channels (confluence, JIRA, discourse, blog)<br>• contribute to quality assurance of technical release aspects (release notes, migration instructions, etc)<br>** Working location: Da Nang **<br><br>Please send us your application in English.<br><br>Why will you love working here?<br><br>• Good salary and a bonus if things work well<br>• Working & growing with an international team<br>• Relocate support (for candidates from HN, HCMC want to move to DN): an apartment is provided for the first month in DN<br>• Onsite opportunities: short-term and long-term assignments in Europe<br>• 16 days off allowance per year (on top of public holidays like Tet)<br>• Premium health insurance for you and your spouse (husband or wife)<br>• Flexible working time (40h/week)<br>• Highly professional equipment (own laptop, 2-3 screens, adjustable desks)<br>• Intense English course for the first 3 months by our native English teachers<br>• Optional English seminars during the work time<br>• An all-expenses-paid company trip once a year, month-end with the whole company and team building with the project team every month covered by mgm<br>• Free in-house entertainment facilities (darts, piano, climbing wall), drinks (coffee, beer, soft drinks,…) and food (cookies, fruit,…) and out-house company-funded sport clubs (football, swimming, badminton).<br>",0,,,2,2020-06-27 00:00:00,,,,,IT - Software||IT - Hardware/Networking||High Technology||,<br><br><br><br>,,,,"Technical Consultant (Java, Javascript)",,1591286400,,,1,"General:<br>• Good verbal and written communication in English is required<br>• Preferably +2 years of experience (flexible depending on how fast your learning and technical developing capabilities are)<br>• Degree in engineering or natural sciences (university or technical college)<br>Technical:<br>• Knowing Java, JavaScript is a must<br>• Knowledge of TypeScript, React and Spring eco-system is an advantage<br>• Proven technology and implementation know-how with multitier web applications<br>• Experience with software development tools, processes and architecture<br>Soft skills:<br>• Willingness to learn and build a deep understanding<br>• Proactive in communication, taking responsibility and providing feedback<br>• Be able to work independently and under pressure<br>• Learn to understand how things work rather than finding out by trial and error<br>• A passion for service-oriented collaboration and communication<br>",https://www.vietnamworks.com/technical-consultant-java-javascript-1-1258326-jd,,,,,,,,,,1,,
,1,,,"{""src_url"": ""https://www.vietnamworks.com/java-developer-247-1-1260777-jd"", ""remark"": """", ""cn_remark"": """", ""ext_info"": """", ""company_desc"": ""Website: <br>\n<br>\nCyberLogitec Vietnam is an ODC (Off-shore Development Center) in Vietnam providing outsourcing service for SW Development, Testing and 24/7 Service Desk.<br>\n<br>\nWe specialize in IT solutions for logistics business such as shipping, terminal & yard, warehouse, trucking and forwarding. Also we are researching new technologies for web, mobile, virtual reality and machine learning.<br>\n<br>\nWe have lots of industrial experiences for more than 9 years in logistics business and technology area, and we are providing our service for our global customers in more than 10 countries such as Korea, USA, Thailand, China, Saudi Arabia, Turkey, UAE, Malaysia, India, Japan, Brazil and Singapore.<br>\n<br>\nOur top priority is creating customers’ value with high quality and global standard outsourcing service<br>"", ""company_name"": ""CYBERLOGITEC VIETNAM CO., LTD."", ""company_license"": """", ""tax_id_no"": """", ""register_add"": """", ""work_addr"": ""Scetpa Building, 19A Cong Hoa Street, Ward 12, Tan Binh District, HCMC"", ""mobile"": """", ""website"": """", ""email"": """", ""entity_type"": 0, ""country"": ""VN"", ""city"": """", ""industry"": ""IT - Software||""}",,,,HR Department,,VN,,USD,"- Will be trained and work on Oracle, Java Spring, Action Script, HTML5, AngularJs.<br>- Join one of 2 teams: Product/ Maintenance<br>+ Product: new development projects<br>+ Maintenance: the developed projects which relating to the import and export process.The system has been operating in the US, Japan, Korea and some European countries, etc.<br>- After being clear about the purpose and meaning of the job, everyone will use the internal management system to manage and complete the work.<br>- The task will be done following the close procedure to ensure the high quality before reaching to the user through the internal system.<br>",0,,,2,2020-07-11 00:00:00,,,,,IT - Software||,<br><br><br><br>,,,,Java Developer,,1591891200,,,1,"* Requirement:<br>- At least 1 year working with a good Java programming.<br>- Able to analyze well.<br>- Good attitude and responsibility.<br>- Have good programming skills.<br>- Reading and writing skill in English is good. Fluent speaking, listening is an advantage.<br><br>* Benefits:<br>- Well trained and dedicated to being able to catch the pace smoothly.<br>- Attracted salary based on the ability of the candidate and the general salary framework set by the company.<br>- Salary review every 6 months based on the work performance.<br>- 13th-month salary and bonus for holidays.<br>- Team building once a month.<br>- Company trip once a year.<br>- PVI healthcare insurance.<br>- Full social benefits in accordance with the company and the law of Vietnam.<br>- Professional environment and clear procedures.<br>- Great opportunity to improve English.<br>- Opportunity to learn Logistics and professional management system of project development process.<br><br>* Working time: 8:30 AM - 5:30 PM (From Monday to Friday)<br>",https://www.vietnamworks.com/java-developer-247-1-1260777-jd,,,,,,,,,,1,,
,2,,,"{""src_url"": ""https://www.vietnamworks.com/developer-reactjs-luong-den-1500-usd-1257623-jd"", ""remark"": """", ""cn_remark"": """", ""ext_info"": """", ""company_desc"": ""Bkav là Tập đoàn công nghệ hoạt động trong các lĩnh vực an ninh mạng, phần mềm, chính phủ điện tử, nhà sản xuất smartphone và các thiết bị điện tử thông minh. Bkav là 1 trong 10 thương hiệu Nổi tiếng nhất Việt Nam do Hội Sở hữu trí tuệ Việt Nam bình chọn, nằm trong Top 10 Dịch vụ hoàn hảo do Hội Tiêu chuẩn & Bảo vệ Người tiêu dùng Việt Nam bình chọn.<br>\r\n<br>\r\n Bkav là công ty đầu tiên trên thế giới đã phát hiện và công bố lỗ hổng trong công nghệ nhận dạng khuôn mặt trên máy tính xách tay ngay khi công nghệ này bắt đầu phổ biến. Nhận diện khuôn mặt được đánh giá có độ chính xác cao, được nhiều hãng công nghệ trên toàn cầu: như Toshiba, Lenovo, Asus… ứng dụng vào sản phẩm của mình.<br>\r\n<br>\r\n Bkav là công ty đầu tiên trên thế giới công bố phát hiện lỗ hổng nghiêm trọng trên Google Chrome chỉ vài ngày sau khi trình duyệt này ra mắt (9/2008). Hiện, Google Chrome là trình duyệt web được sử dụng phổ biến nhất trên thế giới.<br>\r\n<br>\r\n Bkav là công ty đầu tiên trên thế giới xác định được nguồn gốc cuộc tấn công vào hàng loạt website của cơ quan chính phủ Mỹ, Hàn Quốc, bao gồm cả website của tổng thống Hàn Quốc (Tháng7/2009). Đây là một trong những cuộc tấn công lớn nhất trong lịch sử của an ninh mạng thế giới. Sự kiện đã được viết thành 1 chương trong cuốn sách nổi tiếng “Bên trong chiến tranh không gian mạng” do NXB O’ Reilly (Mỹ) xuất bản.<br>\r\n<br>\r\n Bkav là công ty đầu tiên trên thế giới tìm ra lỗ hổng của hệ thống nhận diện khuôn mặt - Face ID của iPhone X chỉ 2 tuần sau khi iPhone X chính thức bán ra thị trường (11/ 2017). Face ID, được Apple coi là bước đột phá công nghệ lớn nhất của mình trên iPhone X. Sự kiện thu hút hàng trăm tờ báo lớn quốc tế đưa tin, đặc biệt bức ảnh chụp chiếc mặt nạ được Bkav chế tạo để vượt qua tính năng Face ID trên iPhone X được hãng thông tấn Reuter bình chọn là một trong 10 bức ảnh ấn tượng nhất trên thế giới trong tuần. Trước đó, Bkav cũng đã phát hiện ra lỗ hổng trong công nghệ nhận diện mống mắt trên trên dòng điện thoại Samsung Galaxy S8.<br>\r\n<br>\r\n Bkav là nhà tổ chức cuộc thi cuộc thi an ninh mạng toàn cầu WhiteHat Grand Prix. Cuộc có uy tín với cộng đồng an ninh mạng trên thế giới và luôn thu hút được nhiều đội thi đứng đầu CTF Times (Bảng xếp hạng an ninh mạng hàng đầu thế giới) tham dự.<br>\r\n<br>\r\nBkav là nhà công ty tiên phong với xứ mệnh xây dựng ngành công nghiệp sản xuất smartphone của Việt Nam. Hai năm liên tiếp sự kiện ra mắt điện thoại thông minh Bphone đều được bình chọn là một trong 10 sự kiện công nghệ của năm.<br>\r\n<br>\r\n Bkav là doanh nghiệp đầu tiên của Việt Nam lọt vào Danh sách các công ty hấp dẫn (Cool Vendors) tại các thị trường mới nổi trên toàn cầu do Gartner, hãng tư vấn CNTT hàng đầu thế giới công bố. Tập đoàn đã thành lập Bkav USA đặt tại Thung lũng Silicon, Mountain View, bang California – Mỹ.<br>\r\n<br>\r\nTrong nhiều năm qua, phần mềm diệt virus của Bkav được bình chọn là “Sản phẩm An toàn thông tin được người dùng ưa chuộng nhất”, Công ty nhiều năm liên tiếp được trao Cup tự hào thương hiệu Việt. Tại thị trường trong nước, phần mềm Bkav chiếm ưu thế áp đảo so với các phần mềm diệt virus của nước ngoài khi có tới 73,95% các doanh nghiệp lựa chọn sử dụng. (Theo kết quả xếp hạng các thương hiệu phần mềm được doanh nghiệp ưa chuộng, do Phòng Thương mại và Công nghiệp Việt Nam - VCCI thực hiện).<br>\r\n<br>\r\n Người sáng lập Bkav, ông Nguyễn Tử Quảng hiện là Chủ tịch Hội đồng quản trị kiêm Tổng giám đốc (CEO). Ông được bình chọn là một trong 10 gương mặt trẻ tiêu biểu Việt Nam vào năm 1998 và là Hiệp sỹ Công nghệ thông tin do cộng đồng và tạp chí eChip bình chọn vào năm 2003. Năm 2012, ông được vinh danh là Người tiên phong đặt nền móng cho lĩnh vực an ninh mạng tại Việt Nam (Báo điện tử VnExpress tổ chức bình chọn). CEO Nguyễn Tử Quảng cũng là 1 trong 10 nhân vật ICT Việt Nam tiêu biểu của Thập kỷ (2000) - (2010) do Hội nhà báo CNTT bình chọn. Năm 2017, ông được Hiệp hội Internet Việt Nam vinh danh là một trong 10 nhân vật tiêu biểu có ảnh hưởng tới sự phát triển của Internet tại Việt Nam trong 1 thập kỷ (2007) - (2017).<br>"", ""company_name"": ""CÔNG TY CỔ PHẦN BKAV"", ""company_license"": """", ""tax_id_no"": """", ""register_add"": """", ""work_addr"": ""Tòa nhà Bkav – Khu đô thị Yên Hòa – Cầu Giấy – Hà Nội / Số 67 đường số 3, khu dân dư CityLand, P.7, Q. Gò Vấp, TP. HCM"", ""mobile"": """", ""website"": """", ""email"": """", ""entity_type"": 0, ""country"": ""VN"", ""city"": """", ""industry"": ""IT - Software||""}",,,,Ms.Nhung – Ban Tuyển Dụng,,VN,,USD,"Chúng tôi cần tuyển gấp ứng viên vào vị trí công việc Lập Trình Viên ReactJS<br>Số lượng: 15 người.<br><br>-	Tham gia phát triển các dự án phần mềm, ứng dụng trên nền tảng Web (Front-end, Back-end, Webservice), các dự án cùng CSDL lớn (BigData), AI trong các lĩnh vực:<br>•	Đô thị thông minh<br>•	Cổng thông tin điện tử<br>•	Hành chính công<br>•	Giáo dục thông minh<br>•	Y tế thông minh<br>•	…<br>Quyền lợi được hưởng:<br>-	Môi trường làm việc mới, máy tính lập trình cấu hình mạnh. Môi trường làm việc ổn định, lâu dài, cơ hội học hỏi các công nghệ mới nhất, cơ hội trưởng thành, tiến thân.<br>-	Xét tăng lương 2 lần/năm theo năng lực và hiệu quả công việc.<br>-	Chế độ thưởng theo dự án, thưởng theo tình hình sản xuất kinh doanh cuối năm.<br>-	Được khám sức khỏe định kỳ hàng năm.<br>-	Các khoản phụ cấp khác: Phụ cấp ăn trưa, hỗ trợ xăng xe (Đối với trường hợp nhà xa).<br>-	Được đóng BHXH, BHYT, BHTN.<br>Địa điểm làm việc: Hà Nội.<br>Mức lương: Tuỳ theo năng lực, kinh nghiệm và thâm niên. Từ 550 USD đến 1500 USD<br>",0,,,2,2020-06-23 00:00:00,,,,,IT - Software||,<br><br><br><br>,1500,550,,Developer ReactJS – Lương Đến 1500 USD,,1591113600,,,1,"-	Yêu thích ngành Công nghệ Thông tin, yêu thích, đam mê lập trình.<br>-	Hiểu biết, sử dụng tốt các thư viện UI component dành cho ReactJS (Material UI, React Bootstrap, Element React…), với kinh nghiệm từ 2 năm trở lên.<br>-	Thành thạo Javascript, Jquery/Ajax, HTML5, CSS3, Bootstrap 4<br>-	Có kiến thức Rest API, Fetch API, Axios library<br><br>Ưu tiên:<br>-	Ưu tiên ứng viên có các chứng chỉ lập trình quốc tế<br>-	Có kiến thức, kinh nghiệm cao về: lập trình Web, làm việc với cơ sở dữ liệu MSSQL/MySQL<br>-	Có kinh nghiệm code trên các framework như AngularJS, VueJS, Flutter…<br>-	Có kỹ năng Phân tích thiết kế hệ thống phần mềm, có kinh nghiệm phát triển các dự án phần mềm theo quy trình Agile/Scrum<br>- Biết cắt HTML, CSS từ Figma<br>",https://www.vietnamworks.com/developer-reactjs-luong-den-1500-usd-1257623-jd,,,,,,,,,,1,,
