apply_cnt,city,cn_remark,company_desc,company_detail,company_license,company_name,contact_email,contact_name,contact_phone,country,creator,currency,desc,edu_level,email,entity_type,entry_type,expire_time,ext_info,fb_share_cnt,fev_cnt,hiring_count,industry,job_benefits,max_salary,min_salary,mobile,name,position,publish_time,register_add,remark,salary_type,skills,src_url,status,sys_tags,tags,tax_id_no,view_cnt,website,work_addr,work_time_end,work_time_start,work_type,workday,zalo_share_cnt
,2,,,"{""src_url"": ""https://www.vietnamworks.com/ai-engineer-8-1258824-jd"", ""remark"": """", ""cn_remark"": """", ""ext_info"": """", ""company_desc"": ""Công ty TNHH Cung cấp Giải pháp Dịch vụ Giá trị Gia tăng (VIVAS) trực thuộc Công ty Cổ phần Công nghệ Công nghiệp Bưu chính Viễn thông Việt Nam (VNPT Technology), đơn vị thành viên của Tập đoàn VNPT, tiền thân là liên doanh giữa Tập đoàn VNPT và Tập đoàn Alcatel Lucent (Pháp). Với thế mạnh của mình, VIVAS tự tin vào việc phát triển các giải pháp toàn diện, sản phẩm chất lượng cũng như dịch vụ khách hàng hoàn hảo trong lĩnh vực Viễn thông và Công nghệ Thông tin, mang lại sự hài lòng tối đa cho khách hàng và các đối tác.<br>\r\n<br>\r\nHiện nay, VIVAS đang phát triển hàng loạt dự án giới thiệu các sản phẩm công nghệ mới, đáp ứng được nhu cầu sử dụng dịch vụ ngày càng đa dạng của người dùng như: phủ sóng Wifi toàn quốc VNPT Wifi, Internet TV, hệ thống thanh toán (Payment), kho ứng dụng (Apps store), SMS brandname, mạng xã hội Zoota, các dịch vụ VAS và dịch vụ OTT,…<br>\r\n<br>\r\nVới khối lượng và số lượng các giải pháp, sản phẩm và dịch vụ không ngừng phát triển trong thời gian tới, VIVAS chào đón các ứng viên với tài năng, lòng đam mê và sự năng động, sáng tạo, nhiệt huyết của mình gia nhập vào đội ngũ Cán bộ Nhân viên của Công ty<br>"", ""company_name"": ""CÔNG TY TNHH CUNG CẤP GIẢI PHÁP DỊCH VỤ GIÁ TRỊ GIA TĂNG (VIVAS)"", ""company_license"": """", ""tax_id_no"": """", ""register_add"": """", ""work_addr"": ""124 Hoàng Quốc Việt, Cầu Giấy, Hà Nội"", ""mobile"": """", ""website"": """", ""email"": """", ""entity_type"": 0, ""country"": ""VN"", ""city"": """", ""industry"": ""IT - Software||Telecommunications||""}",,,,Mrs. Sâm,,VN,,USD,"-	Tham gia các dự án phân tích hình ảnh cho camera giám sát như nhận diện khuôn mặt, giao thông thông minh, an ninh trật tự…<br>-	Tham gia các dự án khai phá dữ liệu trên tập dữ liệu lớn của nhà mạng viễn thông như phân tích ,dự đoán, gợi ý…<br>",2,,,2,2020-07-03 00:00:00,,,,,IT - Software||Telecommunications||,<br><br><br><br>,1000,500,,AI Engineer,,1591545600,,,1,"-	Tốt nghiệp Đại học chính quy chuyên ngành CNTT, ĐTVT hoặc tương đương<br>-	Có kiến thức cơ bản về Học máy (Machine Learingg , Deep Learning)<br>-	Có kinh nghiệm sử dụng 1 trong các ngôn ngữ lập trình Python, C/C++, Java…<br>-	Có tư duy logic và thuật toán tốt<br>-	Có khả năng giao tiếp và đọc hiểu tài liệu kỹ thuật tiếng Anh.<br>CHẤP NHẬN SINH VIÊN NĂM CUỐI HOẶC MỚI TỐT NGHIỆP.<br><br>Ưu tiên:<br>-	Ưu tiên ứng viên có kiến thức về Computer Vision, Image Processing, Voice Recognition, Speech Processing, NLP<br><br>Quyền lợi:<br>-	Chế độ lương thưởng hấp dẫn (1 năm được 15-17 tháng lương), thưởng theo dự án.<br>-	Đánh giá xét tăng lương 2 lần/năm, có năng lực sẽ được đánh giá ngay tại thời điểm.<br>-	Được hỗ trợ ăn trưa, văn phòng rộng rãi, thoáng mát, tiện nghi để bạn thỏa sức sáng tạo ý tưởng.<br>-	Được làm việc với các chuyên gia hàng đầu nhiều kinh nghiệm sẽ giúp bạn tích lũy nâng cao kiến thức.<br>-	Có cơ hội làm các hệ thống thực tế, xử lý các bài toán lớn<br>-	Tham gia vào các khâu từ lên kế hoạch, triển khai, vận hành, tối ưu hệ thống dịch vụ<br>-	Các chuyến đi công tác nước ngoài, được tài trợ các hoạt động cộng đồng trong team, được giao lưu nâng cao kiến thức lập trình và trải nghiệm thực tế.<br>-	Được tham gia vào các khóa học đào tạo chuyên nghiệp chắc chắn sẽ giúp bạn nâng cao kiến thức và phát triển năng lực bản thân. Cơ hội thăng tiến cao<br>-	Nghỉ mát hàng năm.<br>",https://www.vietnamworks.com/ai-engineer-8-1258824-jd,,,,,,,,,,1,,
,2,,,"{""src_url"": ""https://www.vietnamworks.com/delivery-lead-1-1257204-jd"", ""remark"": """", ""cn_remark"": """", ""ext_info"": """", ""company_desc"": ""TẦM NHÌN:<br>\nTrở thành Ngân hàng tốt nhất và doanh nghiệp hàng đầu Việt Nam<br>\n<br>\nSỨ MỆNH:<br>\n•\tTrở thành đối tác tài chính được lựa chọn và đáng tin cậy nhất của khách hàng nhờ khả năng cung cấp đầy đủ các sản phẩm và dịch vụ tài chính đa dạng và dựa trên cơ sở luôn coi khách hàng làm trọng tâm.<br>\n•\tTạo dựng cho cán bộ nhân viên một môi trường làm việc tốt nhất với nhiều cơ hội để phát triển năng lực, đóng góp giá trị và tạo dựng sự nghiệp thành đạt.<br>\n•\tMang lại cho cổ đông những lợi ích hấp dẫn, lâu dài thông qua việc triển khai một chiến lược phát triển kinh doanh nhanh mạnh song song với việc áp dụng các thông lệ quản trị doanh nghiệp và quản lý rủi ro chặt chẽ theo tiêu chuẩn quốc tế.<br>\n<br>\nGIÁ TRỊ CỐT LÕI:<br>\nGiá trị Techcombank cam kết mang lại cho khách hàng trong nhiều năm qua.<br>\n1. Khách hàng là trên hết nhấn mạnh rằng chúng ta trân trọng từng khách hàng và luôn nỗ lực mang đến những sản phẩm, dịch vụ đáp ứng tốt nhất nhu cầu của khách hàng.<br>\n2. Liên tục cải tiến có nghĩa là chúng ta đã tốt nhưng luôn có thể tốt hơn , vì vậy chúng ta sẽ không ngừng học hỏi và cải thiện.<br>\n3. Tinh thần phối hợp có nghĩa là chúng ta tin tưởng vào đồng nghiệp của mình và hợp tác để cùng mang lại điều tốt nhất cho ngân hàng.<br>\n4. Phát triển nhân lực có nghĩa là chúng ta tạo điều kiện cán bộ nhân viên có thể phát huy tối đa năng lực của mỗi cá nhânvà khen thưởng xứng đáng cho những người đạt thành tích.<br>\n5. Cam kết hành động có nghĩa là chúng ta luôn đảm bảo rằng công việc đã được cam kết sẽ phải được hoàn thành. <br>\n<br>\nWebsite: H<br>"", ""company_name"": ""TECHCOMBANK"", ""company_license"": """", ""tax_id_no"": """", ""register_add"": """", ""work_addr"": ""Head Office,14th Floor, Techcombank Tower, 191 Ba Trieu Street, Hai Ba Trung District, Hanoi, Vietnam"", ""mobile"": """", ""website"": """", ""email"": """", ""entity_type"": 0, ""country"": ""VN"", ""city"": """", ""industry"": ""IT - Software||IT - Hardware/Networking||""}",,,,,,VN,,USD,"* Location: Head Office, Hanoi<br>Division: Digital Transformation Office<br>Unit: Technology Tribe<br><br>* Tribe Purpose<br>•	The Technology Tribe will support the business by building solutions required to deliver on the bank's digital strategy.<br>•	The Technology Tribe will advise and design solutions based on requirements from and feasibilities of other tribes, develop solutions based on the architecture blueprint while ensuring quality assurance throughout the development and execution of solutions.<br>•	The Technology Tribe will be equipped with forefront programming skills and knowledge of digital technologies so as to be able to provide innovative design solutions and advice on improvements needed to meet business needs<br><br>* Job Purpose<br>•	The job holder is responsible for leading development projects across front and back end developers to manage the successful delivery of projects through planning, coordinating and leading activities across the full delivery lifecycle<br>•	The job holder will offer technical support and guidance to FE and BE developers and is a subject matter expert in software development using different programming languages<br><br>* RESPONSIBILITIES<br>Software Development<br>•	Lead development team towards successful project delivery by providing technical guidance across the software development lifecycle<br>•	Maintain high standards of web quality within the team by establishing good practices and habits<br>•	Drive discussions with other developers, business analysts and software architects to plan, design, develop, test and maintain web applications technologies<br>•	Oversee timely analysis and resolution of technical and application problems in squads<br>•	Proactively identify areas of improvement required to improve business process whilst minimizing disruptions to business<br>•	Assess opportunities for application and process improvement and prepare documentation of rationale to share with squad members and other stakeholders<br>•	Ensure timely delivery of projects whilst adhering to high-quality development principles<br>•	Assist the Technology Tribe Lead in the development of the tribe’s blueprint based on Techcombank business needs and objectives<br><br>Managing Projects<br>•	Manage project conflicts, challenges and dynamic business requirements to keep operations running at high performance<br>•	Work with team leads to resolve people problems and project roadblocks, conduct post mortem and root cause analysis to help squads continuously improve their practices to ensure maximum productivity<br><br>Managing Talent<br>•	Mentor and coach junior developers to become fully competent Developers<br>•	Provide technical leadership to the tribe through coaching and mentorship<br>",0,,,2,2020-06-21 00:00:00,,,,,IT - Software||IT - Hardware/Networking||,<br><br><br><br>,,,,Delivery Lead,,1591027200,,,1,"* Domain Expertise<br>•	7+ years of relevant experience with prior experience in a technical leadership experience<br>•	Mastery in programming languages related to application development (HTML, CSS, JavaScript, Reac, Python, PHP, NodeJS, Java or Ruby)<br>•	Experience in managing technical teams (able to lead and influence others) and in workplace mediation<br>•	Experience in leading and managing the delivery of system/software development projects in a structured environment<br>•	Experience in both architecture and implementation-level software design<br><br>* Agile / Digital Experience<br>•	Deep experience in Agile Software Development and has mastery of Agile methodology and practices<br>•	Experience working in Agile teams to lead successful digital transformation projects, involved in the end-to-end planning to implementation<br><br>* Qualifications<br>•	Bachelor's degree in computer science, software engineering or information technology<br><br>* Competencies<br>To succeed in this role, the job holder is expected to strengthen and demonstrate these core skills and behaviors:<br>•	Digital Literacy<br>Regularly evaluates the appropriateness of technological improvements & workplace tools and justifies investment in technology to adopt a holistic digital space, improving overall service delivery of the organization<br>•	Agility & Innovation<br>Depicts strong resilience and a mindset of continuous change improvement, being creative and innovative in creating value to the organization; demonstrates knowledge of Agile at scale and leads teams to adapt agile best practices and generate innovations<br>•	Impactful Communication<br>Handholds the team on the nuances of impactful communication (such as perceiving non-verbal cues and body language etc. ) and coaches them to use it effectively to make ones presence felt.<br>•	Influencing & Negotiation<br>Demonstrates ability to convince others effectively when there are conflicting views. Uses appropriate facts and does his/her research before approaching the stakeholder and is able to convince different stakeholders of the benefits of one’s own viewpoint<br>•	Development Orientation<br>Takes ownership for self-development by proactively identifying new and innovative learning opportunities<br>•	Problem Solving & Ownership<br>Creates relevant and creative options for identified problems and integrates with the overall business system and determines the “long term” implications of each option; Support others in identifying root causes and solutions to a problem and encourage others in their self-decision making process<br>•	Analytical Thinking<br>Analyses and translates data into actionable insights and recommendations<br>•	Business Acumen<br>Understands  business goals & objective and able to point initiatives that will create value to business and customers<br>•	Financial Acumen<br>Understand company financial metrics and a project's direct and indirect financial impact<br>•	Strategic Orientation<br>Identifies strategic opportunities that will generate exponential returns. Percolates the understanding of strategy to the team as well.<br>•	Application Architecture<br>Develops the enterprise architecture and guides team in developing application architectures which meets business requirements<br>•	Programming<br>Develops and audits complicated programs and highlights both pros and cons of each process while driving alignment to firm’s strategic vision; Able to influence and teach others on programming standards; Familiar with 12-factor app methodology and makes it common practice<br>•	Software Configuration<br>Sets up deployment platform and managing changes/updates introduced to solutions by controlling the deployment release in a systematic manner<br>•	Systematic Thinking<br>Visualizes & understands overall design structure and how each components contribute to the overall system<br>•	Technology Application<br>Researches on new functions and features of technology and integrates it to create an efficient system for the organization<br>",https://www.vietnamworks.com/delivery-lead-1-1257204-jd,,,,,,,,,,1,,
,1,,,"{""src_url"": ""https://www.vietnamworks.com/urgent-senior-backend-nodejs-1000-2000-1-1259363-jd"", ""remark"": """", ""cn_remark"": """", ""ext_info"": """", ""company_desc"": ""Join the dynamic and successful team behind iCondo (www.icondo.asia) to continually improve Singapore's No. 1 property management software platform. <br>\nGet involved in many other new and exciting projects with leading technologies and solutions.<br>\nWe are now open and looking for talents who have collaborative spirit, good attitudes and affordable skills to join our happy family.<br>"", ""company_name"": ""STAGEIT CO., LTD"", ""company_license"": """", ""tax_id_no"": """", ""register_add"": """", ""work_addr"": ""187/9/27 Bạch Đằng, Phường 2, Quận Tân Bình, Tp. Hồ Chí Minh"", ""mobile"": """", ""website"": """", ""email"": """", ""entity_type"": 0, ""country"": ""VN"", ""city"": """", ""industry"": ""IT - Software||""}",,,,,,VN,,USD,"We are looking for Software engineers to help us:<br>•	Develop backend features using RESTful API, NodeJS and Typescript<br>•	Contribute on designing database<br>•	Contribute on improving coding standard and process from the scratch to deployment<br>•	Design and implement features using NodeJS and make sure it could support maintenance, extensible, readable for other members when transferring tasks<br>•	Refactor, improve source code and do optimization<br>•	Write high-quality, clean, simple, and maintainable code, build common libraries<br>***Please submit your CV in PDF file format***<br>",0,,,2,2020-07-05 00:00:00,,,,,IT - Software||,<br><br><br><br>,,,,[Urgent] - Senior Backend NodeJS - [1000$ ~2000$],,1591632000,,,1,"1/ Must have<br>- At least 3+ years of relevant working experience as a developer;<br>- At least 2 years of experience in NodeJS, ExpressJS, Typescript, PostgreSQL;<br>- Experience in database design skills;<br>- Experience with Git;<br>- Experience with Docker;<br>- English (writing and reading).<br><br>2/ Nice to have<br>- Github and Stackoverflow profile;<br>- DevOps skills is a big plus;<br>- Experience in consuming and developing RESTful APIs;<br>- Experience in building scalable distributed service and data-heavy features is a huge advantage;<br>- Knowledge and experience in server setup/configuration (Linux or other *nix) and cloud platform (Amazon/Google/Microsoft) management;<br>- Be available for working now.<br><br>3/ BENEFITS:<br>- Attractive salary with annual salary review & 13th-month salary;<br>MacBook Pro is provided for work;<br>- Paid remaining annual leave;<br>- 12 days annual leave, working from Monday to Friday;<br>- Annual health check-ups & other benefits: wedding, funeral, offspring delivery support;<br>- Social/ Health/ Unemployment Insurances according to Vietnam Labour Law;<br>- Annual company trips, company events, team building activities,...<br>- Offering free snack, tea, coffee, energy drinks and by-choice request at the pantry;<br>- A friendly, dynamic and well-equipped environment to be creative;<br>- Chance to work on exciting projects and work with fascinating overseas clients.<br>",https://www.vietnamworks.com/urgent-senior-backend-nodejs-1000-2000-1-1259363-jd,,,,,,,,,,1,,
,2,,,"{""src_url"": ""https://www.vietnamworks.com/data-engineer-khoi-it-1-1-1-1252482-jd"", ""remark"": """", ""cn_remark"": """", ""ext_info"": """", ""company_desc"": ""TẦM NHÌN:<br>\nTrở thành Ngân hàng tốt nhất và doanh nghiệp hàng đầu Việt Nam<br>\n<br>\nSỨ MỆNH:<br>\n•\tTrở thành đối tác tài chính được lựa chọn và đáng tin cậy nhất của khách hàng nhờ khả năng cung cấp đầy đủ các sản phẩm và dịch vụ tài chính đa dạng và dựa trên cơ sở luôn coi khách hàng làm trọng tâm.<br>\n•\tTạo dựng cho cán bộ nhân viên một môi trường làm việc tốt nhất với nhiều cơ hội để phát triển năng lực, đóng góp giá trị và tạo dựng sự nghiệp thành đạt.<br>\n•\tMang lại cho cổ đông những lợi ích hấp dẫn, lâu dài thông qua việc triển khai một chiến lược phát triển kinh doanh nhanh mạnh song song với việc áp dụng các thông lệ quản trị doanh nghiệp và quản lý rủi ro chặt chẽ theo tiêu chuẩn quốc tế.<br>\n<br>\nGIÁ TRỊ CỐT LÕI:<br>\nGiá trị Techcombank cam kết mang lại cho khách hàng trong nhiều năm qua.<br>\n1. Khách hàng là trên hết nhấn mạnh rằng chúng ta trân trọng từng khách hàng và luôn nỗ lực mang đến những sản phẩm, dịch vụ đáp ứng tốt nhất nhu cầu của khách hàng.<br>\n2. Liên tục cải tiến có nghĩa là chúng ta đã tốt nhưng luôn có thể tốt hơn , vì vậy chúng ta sẽ không ngừng học hỏi và cải thiện.<br>\n3. Tinh thần phối hợp có nghĩa là chúng ta tin tưởng vào đồng nghiệp của mình và hợp tác để cùng mang lại điều tốt nhất cho ngân hàng.<br>\n4. Phát triển nhân lực có nghĩa là chúng ta tạo điều kiện cán bộ nhân viên có thể phát huy tối đa năng lực của mỗi cá nhânvà khen thưởng xứng đáng cho những người đạt thành tích.<br>\n5. Cam kết hành động có nghĩa là chúng ta luôn đảm bảo rằng công việc đã được cam kết sẽ phải được hoàn thành. <br>\n<br>\nWebsite: H<br>"", ""company_name"": ""TECHCOMBANK"", ""company_license"": """", ""tax_id_no"": """", ""register_add"": """", ""work_addr"": ""Head Office,14th Floor, Techcombank Tower, 191 Ba Trieu Street, Hai Ba Trung District, Hanoi, Vietnam"", ""mobile"": """", ""website"": """", ""email"": """", ""entity_type"": 0, ""country"": ""VN"", ""city"": """", ""industry"": ""IT - Software||Banking||IT - Hardware/Networking||""}",,,,Ms Ngân,,VN,,USD,"Khả năng lập trình với các loại ngôn ngữ: PL/SQL, (Java, C#.NET … là một lợi thế)<br><br>Làm việc và sử dụng<br><br>- Cơ sở dữ liệu: Oracle, MS SQL, (tuning các câu lệnh phức tạp, xử lý dữ liệu rất lớn)<br>- Công cụ về Business Intelligence (OBIEE, Cognos …)<br>- Công cụ về ETL (ODI, SSIS, DataStage …)<br>- Quản lý phiên bản với Git, SVN …<br>- Các kiến thức cần có:<br><br>- Kiến trúc, luồng xử lý của Data Warehouse<br>- Data Modelling - 3NF và Star/Snowflake<br>- Slowly Changing Dimensions hoặc hiểu về khái niệm lưu trữ thay đổi theo thời gian của dữ liệu<br>- Chuẩn message XML, JSON<br>",0,,,2,2020-05-24 00:00:00,,,,,IT - Software||Banking||IT - Hardware/Networking||,<br><br><br>,,,,"Data Engineer, Khối IT",,1589817600,,,1,"Các kiến thức cần có:<br><br>- Kiến trúc, luồng xử lý của Data Warehouse<br>- Data Modelling - 3NF và Star/Snowflake<br>- Slowly Changing Dimensions hoặc hiểu về khái niệm lưu trữ thay đổi theo thời gian của dữ liệu<br>- Chuẩn message XML, JSON<br><br><br>Các kỹ năng<br><br>- Học hỏi liên tục<br>- Quản lý thời gian và tổ chức công việc hiệu quả<br>- Hiểu rõ quy trình phát triển phần mềm, các giai đoạn test, biết Agile và Scrum<br>- Chia sẻ kiến thức trong nhóm<br>- Hiểu nghiệp vụ ngân hàng<br>- Chủ động xử lý vấn đề<br>- Có kỹ năng tiếng Anh giao tiếp<br>",https://www.vietnamworks.com/data-engineer-khoi-it-1-1-1-1252482-jd,,,,,,,,,,1,,
