apply_cnt,city,cn_remark,company_desc,company_detail,company_license,company_name,contact_email,contact_name,contact_phone,country,creator,currency,desc,edu_level,email,entity_type,entry_type,expire_time,ext_info,fb_share_cnt,fev_cnt,hiring_count,industry,job_benefits,max_salary,min_salary,mobile,name,position,publish_time,register_add,remark,salary_type,skills,src_url,status,sys_tags,tags,tax_id_no,view_cnt,website,work_addr,work_time_end,work_time_start,work_type,workday,zalo_share_cnt
,2,,,"{""src_url"": ""https://www.vietnamworks.com/chuyen-vien-phat-trien-du-lieu-va-bigdata-4-1-1258597-jd"", ""remark"": """", ""cn_remark"": """", ""ext_info"": """", ""company_desc"": ""Được thành lập từ tháng 5 năm 2000 bởi Ngân hàng TMCP Quân đội (MB), Công ty CP Chứng khoán MB (MBS) là một trong 5 công ty chứng khoán đầu tiên tại Việt Nam. Sau 16 năm không ngừng phát triển, MBS đã trở thành một trong những công ty chứng khoán hàng đầu Việt Nam. <br>\nMạng lưới chi nhánh và các phòng giao dịch của MBS đã được mở rộng và hoạt động có hiệu quả tại nhiều thành phố trọng điểm. MBS đã thu hút và phát triển được một đội ngũ nhân sự năng động trong đó có hàng chục chuyên gia phân tích và hàng trăm chuyên viên quan hệ khách hàng được đào tạo bài bản, có tư cách đạo đức tốt, không ngừng phấn đấu để cung cấp dịch vụ và các giải pháp kinh doanh cho khách hàng với sự cẩn trọng, chuyên nghiệp và trách nhiệm cao nhất.<br>\nVới 5 Giá trị cốt lõi: Sáng tạo đi kèm thực tiễn - Tôn trọng và học tập - Mẫn cán - Tinh thần đồng đội - Trách nhiệm và phát triển cộng đồng, chúng tôi luôn chào đón những ứng viên có khát vọng, có năng lực và sẵn sàng tạo cơ hội phát triển cho các bạn!<br>"", ""company_name"": ""CÔNG TY CỔ PHẦN CHỨNG KHOÁN MB"", ""company_license"": """", ""tax_id_no"": """", ""register_add"": """", ""work_addr"": ""Tầng 7, tòa nhà MB, số 3 Liễu Giai, Ba Đình, Hà Nội"", ""mobile"": """", ""website"": """", ""email"": """", ""entity_type"": 0, ""country"": ""VN"", ""city"": """", ""industry"": ""IT - Software||""}",,,,HR,,VN,,USD,"•	Tham gia nghiên cứu, thiết kế và phát triển các sản phẩm dịch vụ dữ liệu trên các hệ thống Oracle Report, Datawarehouse, ETL dữ liệu;<br>•	Tham gia triển khai các dự án CNTT của Công ty.<br>",2,,,2,2020-06-27 00:00:00,,,,,IT - Software||,<br><br><br><br>,,,,Chuyên Viên Phát Triển Dữ Liệu và Bigdata,,1591286400,,,1,"•	Thành thạo một trong các ngôn ngữ lập trình: PLSQL, Java;<br>•	Nắm rõ các quy chuẩn về quy trình xây dựng và triển khai một phần mềm;<br>•	Tiếng Anh giao tiếp thành thạo.<br>•	Kỹ năng mềm:<br>o	Kỹ năng làm việc nhóm và làm việc độc lập tốt;<br>o	Trung thực, tin cậy, cẩn trọng;<br>o	Có khả năng làm việc dưới môi trường nhiều áp lực, liên tục thay đổi.<br><br>Ưu tiên<br>•	Ưu tiên ứng viên có bằng tốt nghiệp Đại học (Hệ Chính qui) các trường Bách Khoa, HV Công nghệ Bưu chính viễn thông, ĐH Công nghệ, HV Kỹ thuật Quân sự, Đại học nước ngoài có chuyên ngành đào tạo: Công nghệ thông tin, Toán tin (Chấp nhận ứng viên mới tốt nghiệp có bằng loại Khá trở lên các Trường Đại học đã nêu trên);<br>•	Ưu tiên có kinh nghiệm làm việc với các hệ thống ETL (Data Stage, Pentaho, ODI); các hệ thống cơ sở dữ liệu Oracle, DB2, Netezza;<br>•	Ưu tiên các ứng viên có kinh nghiệm làm việc tại các công ty chứng khoán; hiểu biết về sản phẩm dịch vụ chứng khoán;<br>•	Có kinh nghiệm về phân tích, khai phá dữ liệu là lợi thế.<br><br>Quyền lợi:<br>•	Thời gian làm việc 5 ngày/tuần (từ thứ Hai đến thứ Sáu).<br>•	Cơ hội thăng tiến, phát triển nghề nghiệp công bằng.<br>•	Thu nhập hấp dẫn, cạnh tranh.<br>•	Được hưởng chế độ BHXH, BHYT, BHTN, Bảo hiểm sức khỏe theo quy định của Công ty.<br>•	Được tham gia các chương trình đào tạo, huấn luyện của Công ty.<br>•	Môi trường làm việc chuyên nghiệp, thân thiện, năng động.<br>•	Mức lương: theo thỏa thuận<br><br>Thời hạn nhận hồ sơ:<br>•	Phỏng vấn cuốn chiếu ngay khi nhận được hồ sơ đến khi tuyển được ứng viên phù hợp<br><br>Hồ sơ yêu cầu:<br>•	Bản Thông tin ứng viên theo mẫu của MBS.<br>•	Các mẫu thông tin ứng viên/CV khác không theo mẫu MBS là hồ sơ không hợp lệ.<br><br>Nơi nhận hồ sơ:	Nộp Bản Thông tin ứng viên theo mẫu của MBS theo hình thức sau:<br>•	Nộp hồ sơ Online trên website tuyển dụng/Gửi qua VietnamWorks.<br>•	Nộp hồ sơ trực tiếp tại Công ty theo địa chỉ :<br>o	Phòng Nhân sự<br>o	Công Ty Cổ Phần Chứng Khoán MB<br>o	Địa chỉ:   Tầng 7, số 3 Liễu Giai, Hà Nội<br>",https://www.vietnamworks.com/chuyen-vien-phat-trien-du-lieu-va-bigdata-4-1-1258597-jd,,,,,,,,,,1,,
,1,,,"{""src_url"": ""https://www.vietnamworks.com/software-developer-fullstack-developer-strong-backend-1256775-jd"", ""remark"": """", ""cn_remark"": """", ""ext_info"": """", ""company_desc"": ""Navigos Search is the leading, most experienced and highly qualified executive recruitment firm in Vietnam. Our mission is to help people and companies achieve their dream. We do this by matching talented individuals to the jobs for which they are best suited, ensuring that our clients have the right people on board that they need to succeed, and our candidates land the job of their dream. We accomplish this mission thanks to our strong expertise in local labor market, an established and broad network of clients and candidates and a proven recruitment method of international standards.<br>"", ""company_name"": ""NAVIGOS SEARCH'S CLIENT"", ""company_license"": """", ""tax_id_no"": """", ""register_add"": """", ""work_addr"": ""HCMC"", ""mobile"": """", ""website"": """", ""email"": """", ""entity_type"": 0, ""country"": ""VN"", ""city"": """", ""industry"": ""IT - Software||""}",,,,,,VN,,USD,"● Develop the In-house systems such as POS systems and attendance management<br>systems of company<br>● Contribute in all phases of software development lifecycle<br>● Ensure designs are in compliance with specifications<br>● Write well designed, testable, efficient source code<br>● Ensure the best possible performance, quality, and responsiveness of the applications<br>● Support continuous improvement by investigating alternatives and technologies and<br>presenting these for architectural review<br>● Solve complex performance problems and architecture challenges<br>● Help maintain code quality, organization, and optimization<br>● Participate in doing research and give suggestions to improve product quality.<br>● Have an understanding of object-oriented programming<br>● The document is written in Japanese, so Japanese speaker is preferable.<br>",0,,,2,2020-06-19 00:00:00,,,,,IT - Software||,<br><br>,,,,Software Developer/ Fullstack Developer (Strong Backend),,1590940800,,,1,"● Experience in developing one of the languages: PHP / Java / JavaScript (from<br>implementation to test)<br>● Experienced in developing with users using: VCS (Git, Subversion, etc.)<br>Nice to have:<br>● Japanese N3<br>● Experience in software design<br>● Had a time working at Japanese company<br>● Study abroad in Japan<br>● Good communicated ability<br>● Knowledge of Windows development (.NET)<br>",https://www.vietnamworks.com/software-developer-fullstack-developer-strong-backend-1256775-jd,,,,,,,,,,1,,
,2,,,"{""src_url"": ""https://www.vietnamworks.com/urgent-devops-engineer-3-1-1-1-2-1-1-1-1-1-1256816-jd"", ""remark"": """", ""cn_remark"": """", ""ext_info"": """", ""company_desc"": ""Tập đoàn Bưu chính Viễn thông Việt Nam (VNPT) - Nhà cung cấp dịch vụ viễn thông, dịch vụ số hàng đầu Việt Nam - Tập đoàn có danh tiếng về khả năng lãnh đạo, đổi mới chuyên môn xuất sắc. Nhân viên của chúng tôi sử dụng sự sáng tạo và tài năng để phát minh ra những giải pháp mới, đáp ứng nhu cầu mới và cung cấp sản phẩm/dịch vụvụ hiệu quả nhất trong ngành. Với hơn 70 năm xây dựng và phát triển gắn bó trên thị trường Viễn thông Việt NamNam, với 63 tỉnh thành có mạng lưới di động phủ sóng: hơn 20 triệu thuê bao di động, 11 triệu thuê bao băng rộng cố định, 10 triệu thuê bao điện thoại cố định<br>\n<br>\nVNPT đặt mục tiêu trở thành nhà cung cấp dịch vụ số hàng đầu Việt Nam và trung tâm dịch vụ Số (Digital Hub) của Châu Á trong những năm tới, để đạt được mục tiêu đó VNPT chuyển dịch nhanh cơ cấu doanh thu từ các dịch vụ viễn thông truyền thống sang dịch vụ số, Công nghệ thông tin<br>\n<br>\nVNPT đặt mục tiêu làm nòng cốt để ngành viễn thông và công nghệ thông tin tại Việt Nam phát triển nhanh và bền vững, cạnh tranh và hội nhập kinh tế Quốc tế có hiệu<br>"", ""company_name"": ""TẬP ĐOÀN BƯU CHÍNH VIỄN THÔNG VIỆT NAM (VNPT)"", ""company_license"": """", ""tax_id_no"": """", ""register_add"": """", ""work_addr"": ""Số 57 phố Huỳnh Thúc Kháng, Phường Láng Hạ, Quận Đống Đa, Thành phố Hà Nội"", ""mobile"": """", ""website"": """", ""email"": """", ""entity_type"": 0, ""country"": ""VN"", ""city"": """", ""industry"": ""IT - Software||IT - Hardware/Networking||""}",,,,Nhóm tuyển dụng,,VN,,USD,"- Nghiên cứu, xây dựng và triển khai hệ thống các công cụ DevOps nhằm nâng cao chất lượng<br>- Quản lý các công cụ DevOps nhằm giám sát chất lượng phần mềm<br>- Xây dựng quy trình sản xuất, triển khai các công cụ DevOps<br>- Tham gia nghiên cứu và hỗ trợ xây dựng các sản phẩm phần mềm theo định hướng DevOps cho VNPT-IT<br>",0,,,2,2020-06-19 00:00:00,,,,,IT - Software||IT - Hardware/Networking||,<br><br><br><br>,1500,800,,[Urgent] Devops Engineer,,1590940800,,,1,"- Tốt nghiệp ĐH  chuyên ngành CNTT, điện tử viễn thông<br>- Có kinh nghiệm lập trình 3-5 năm (Java, Python, Bash, ...)<br>- Có kinh nghiệm sử dụng Docker<br>- Có kinh nghiệm sử dụng thành thạo và quản trị hệ điều hành Linux, UNIX<br>- Có kinh nghiệm về các Web/App Server (Apache, Nginx, IIS, Tomcat, ...)<br>- Có kinh nghiệm quản trị DB (SQL, NoSQL)<br>- Kỹ năng giải quyết vấn đề và thái độ học tập tốt<br><br>Lưu ý: Ứng viên scan bằng cấp gửi kèm CV ứng tuyển<br>",https://www.vietnamworks.com/urgent-devops-engineer-3-1-1-1-2-1-1-1-1-1-1256816-jd,,,,,,,,,,1,,
,2,,,"{""src_url"": ""https://www.vietnamworks.com/chuyen-vien-kien-truc-va-giai-phap-cong-nghe-2-1-1258600-jd"", ""remark"": """", ""cn_remark"": """", ""ext_info"": """", ""company_desc"": ""Được thành lập từ tháng 5 năm 2000 bởi Ngân hàng TMCP Quân đội (MB), Công ty CP Chứng khoán MB (MBS) là một trong 5 công ty chứng khoán đầu tiên tại Việt Nam. Sau 16 năm không ngừng phát triển, MBS đã trở thành một trong những công ty chứng khoán hàng đầu Việt Nam. <br>\nMạng lưới chi nhánh và các phòng giao dịch của MBS đã được mở rộng và hoạt động có hiệu quả tại nhiều thành phố trọng điểm. MBS đã thu hút và phát triển được một đội ngũ nhân sự năng động trong đó có hàng chục chuyên gia phân tích và hàng trăm chuyên viên quan hệ khách hàng được đào tạo bài bản, có tư cách đạo đức tốt, không ngừng phấn đấu để cung cấp dịch vụ và các giải pháp kinh doanh cho khách hàng với sự cẩn trọng, chuyên nghiệp và trách nhiệm cao nhất.<br>\nVới 5 Giá trị cốt lõi: Sáng tạo đi kèm thực tiễn - Tôn trọng và học tập - Mẫn cán - Tinh thần đồng đội - Trách nhiệm và phát triển cộng đồng, chúng tôi luôn chào đón những ứng viên có khát vọng, có năng lực và sẵn sàng tạo cơ hội phát triển cho các bạn!<br>"", ""company_name"": ""CÔNG TY CỔ PHẦN CHỨNG KHOÁN MB"", ""company_license"": """", ""tax_id_no"": """", ""register_add"": """", ""work_addr"": ""Tầng 7, tòa nhà MB, số 3 Liễu Giai, Ba Đình, Hà Nội"", ""mobile"": """", ""website"": """", ""email"": """", ""entity_type"": 0, ""country"": ""VN"", ""city"": """", ""industry"": ""IT - Software||Banking||Securities & Trading||""}",,,,HR,,VN,,USD,"-	Thực hiện công việc theo đúng chính sách, quy định, quy trình, hướng dẫn nội bộ và cam kết chất lượng dịch vụ (SLAs).<br>-	Làm việc trực tiếp với các khối, các đơn vị kinh doanh của Công ty để thu thập, phân tích các yêu cầu nghiệp vụ, thiết kế, xác định các giải pháp công nghệ nhằm đáp ứng các yêu cầu của các đơn vị kinh doanh trên toàn hệ thống.<br>-	Phân tích, nghiên cứu, đánh giá, thiết kế, tư vấn và chi tiết hóa giải pháp công nghệ với các khối nghiệp vụ, kinh doanh; chuyển tiếp cho Ban Phát triển Ứng dụng và/hoặc ban Cung cấp dịch vụ – các đơn vị có trách nhiệm phát triển/hỗ trợ/vận hành các giải pháp<br>-	Tham gia thực hiện, quản trị các dự án công nghệ, nghiên cứu, đánh giá các giải pháp nhằm cải tiến các quy trình của Công ty thông qua sử dụng các giải pháp tự động hóa, áp dụng các tiêu chuẩn tối ưu đã và sẽ được áp dụng rộng rãi trong lĩnh vực kinh doanh của Công ty.<br>-	Phát triển và kiểm soát các hệ thống tiêu chuẩn kiến trúc công nghệ Công ty<br>-	Đưa ra những khuyến nghị, tư vấn cho Ban lãnh đạo trong việc ứng dụng công nghệ mới, kỹ thuật cao, sản phẩm và quy trình thân thiện môi trường nhằm đạt được các mục tiêu chính: giảm bớt chi phí, nâng cao lợi nhuận…<br>-	Hỗ trợ Ban phát triển ứng dụng trong việc đưa vào sử dụng những công cụ hoặc cách tiếp cận phù hợp với kiến trúc công nghệ<br>-	Tham gia thực hiện hỗ trợ giải quyết các sự cố và cải thiện hiệu suất của các hệ thống khi có yêu cầu.<br>-	Thực hiện những đề xuất cho Ban lãnh đạo về những xu hướng, những ứng dụng mới để từ đó xây dựng, cung cấp những sản phẩm và dịch vụ mới.<br>-	Thực hiện nghiên cứu, phân tích đánh giá kỹ thuật tiền khả thi, đánh giá mức độ ảnh hưởng tới các phát triển hiện tại trong quá trình thực hiện các dự án liên quan đến xây dựng, nâng cấp, mở rộng hệ thống của Công ty.<br>-	Phối hợp với các đơn vị trong Khối CNTT (Vận hành, An ninh thông tin) để giải quyết các sự cố công nghệ liên quan.<br>",2,,,2,2020-06-27 00:00:00,,,,,IT - Software||Banking||Securities & Trading||,<br><br><br><br>,,,,Chuyên Viên Kiến Trúc và Giải Pháp Công Nghệ,,1591286400,,,1,"YÊU CẦU TRÌNH ĐỘ:<br>- Tốt nghiệp Đại học trở lên chuyên ngành Công nghệ thông tin hoặc các ngành liên quan.<br>- Hiểu biết về các trong các công nghệ: Net, Java, C/C++, Python, R, NodeJs, ReactJS, Angular IO, Single Sign On, RDBMS, NoSQL DB<br>- Am hiểu 1 trong các lĩnh vự như hệ thống CORE chứng khoán, hạ tầng Microservice, SOA, hệ thống thanh toán, BPM, CRM, hệ thống kho dữ liệu, hệ thống quản trị (MIS), cơ bản về bảo mật, chứng khoán số<br>- Sử dụng thành thao các công cụ xây dựng mô hình như Visio, UML, ORM …<br>- Am hiểu về quy trình cung cấp giải pháp công nghệ trong việc phân tích, phát triển, kiểm thử và triển khai giải pháp phần mềm.<br>- Có kiến thức tốt về các hệ thống ứng dụng.<br>- Tiếng Anh giap tiếp thành thạo.<br><br>YÊU CẦU KỸ NĂNG:<br>- Kỹ năng giao tiếp và truyền thông.<br>- Sáng tạo và liên tục cải tiến<br>- Tinh thần phục vụ khách hàng<br>- Tinh thần trách nhiệm<br>- Kỹ năng làm việc nhóm<br>- Kỹ năng quản lý thời gian và nguồn lực<br>- Kỹ năng khái quát, tư duy logic, phân tích và giải quyết vấn đề<br>- Kỹ năng đàm phán, tư vấn<br>- Tiếng Anh: Nói & viết tốt (sử dụng hàng ngày)<br><br>YÊU CẦU KINH NGHIỆM:<br>- Có kinh nghiệm tham gia xây dựng các giải pháp cho các tổ chức lớn từ 5 năm trở lên.<br>- Có kinh nghiệm thiết kế và xây dựng các giải pháp có khối lượng giao dịch lớn.<br>- Có kinh nghiệm, chuyên môn, hiểu biết sâu sắc về phân tích, thiết kế, lựa chọn các giải pháp kỹ thuật<br><br>Ưu tiên<br>•	Ưu tiên ứng viên có kinh nghiệm làm việc ở môi trường quốc tế hoặc tốt nghiệp tại các trường đại học nước ngoài.<br>•	Nhân sự đã có kinh nghiệm triển khai các dự án lớn (về Tài chính, Chứng khoán, ngân hàng, bảo hiểm, quỹ đầu tư)<br><br>Quyền lợi:<br>•	Thời gian làm việc 5 ngày/tuần (từ thứ Hai đến thứ Sáu).<br>•	Cơ hội thăng tiến, phát triển nghề nghiệp công bằng.<br>•	Thu nhập hấp dẫn, cạnh tranh.<br>•	Được hưởng chế độ BHXH, BHYT, BHTN, Bảo hiểm sức khỏe theo quy định của Công ty.<br>•	Được tham gia các chương trình đào tạo, huấn luyện của Công ty.<br>•	Môi trường làm việc chuyên nghiệp, thân thiện, năng động.<br>•	Mức lương: theo thỏa thuận<br><br>Thời hạn nhận hồ sơ:<br>•	 (Phỏng vấn cuốn chiếu ngay khi nhận được hồ sơ đến khi tuyển được ứng viên phù hợp)<br><br>Hồ sơ yêu cầu:<br>•	Bản Thông tin ứng viên theo mẫu của MBS.<br>•	Các mẫu thông tin ứng viên/CV khác không theo mẫu MBS là hồ sơ không hợp lệ<br><br>Nơi nhận hồ sơ:	Nộp Bản Thông tin ứng viên theo mẫu của MBS theo hình thức sau:<br>•	Nộp hồ sơ Online trên website tuyển dụng/Gửi qua VietnamWorks.<br>•	Nộp hồ sơ trực tiếp tại Công ty theo địa chỉ :<br>o	Phòng Nhân sự<br>o	Công Ty Cổ Phần Chứng Khoán MB<br>o	Địa chỉ:   Tầng 7, số 3 Liễu Giai, Hà Nội<br>",https://www.vietnamworks.com/chuyen-vien-kien-truc-va-giai-phap-cong-nghe-2-1-1258600-jd,,,,,,,,,,1,,
,2,,,"{""src_url"": ""https://www.vietnamworks.com/java-core-developers-fresher-den-1-nam-kinh-nghiem-1260010-jd"", ""remark"": """", ""cn_remark"": """", ""ext_info"": """", ""company_desc"": ""Công ty Giải pháp Phần mềm Tài chính (FSS) chuyên xây dựng và cung cấp các giải pháp và dịch vụ phần mềm cho các ngân hàng, các công ty chứng khoán, các sàn giao dịch và các khách hàng khác trong lĩnh vực dịch vụ tài chính tại Việt Nam. Sau hơn 12 năm liên tục phát triển, với đội ngũ gần 250 chuyên gia phần mềm, FSS đã trở thành một trong những công ty phần mềm hàng đầu trong lĩnh vực tài chính – ngân hàng tại Việt Nam, cung cấp sản phẩm và dịch vụ cho nhiều ngân hàng và công ty chứng khoán lớn.<br>"", ""company_name"": ""CÔNG TY CỔ PHẦN GIẢI PHÁP PHẦN MỀM TÀI CHÍNH - FINANCIAL SOFTWARE SOLUTIONS"", ""company_license"": """", ""tax_id_no"": """", ""register_add"": """", ""work_addr"": ""Tầng 7&8, Số 315 Trường Chinh, Q. Thanh Xuân, Hà Nội"", ""mobile"": """", ""website"": """", ""email"": """", ""entity_type"": 0, ""country"": ""VN"", ""city"": """", ""industry"": ""IT - Software||""}",,,,Phòng Nhân Sự,,VN,,USD,Số lượng: 05 người<br><br>Công việc<br>-	Tham gia thiết kế và lập trình các dự án phần mềm trong lĩnh vực Chứng khoán.<br>Nơi làm việc:  Hà Nội<br>,2,,,2,2020-07-07 00:00:00,,,,,IT - Software||,<br><br><br><br>,,,,Java Core Developers (Fresher Đến 1 Năm Kinh Nghiệm),,1591718400,,,1,"Yêu cầu<br>-	Tốt nghiệp Đại học chuyên ngành Công nghệ thông tin hoặc các ngành liên quan;<br>-	Có kinh nghiệm lập trình trên nền tảng Java;<br>-	Thành thạo Java core, Spring Framework, Hibernate, Transaction Management;<br>-	Có kiến thức về Cơ sở dữ liệu PostgreSQL, hiểu về kiến trúc Microservices, RESTful APIs;<br>-	Am hiểu và sử dụng tốt OOP & Design Patterns.<br><br>Quyền lợi<br>-	Được đào tạo đầy đủ về hệ thống ứng dụng và nghiệp vụ của các ứng dụng đang triển khai;<br>-	Chế độ đãi ngộ cao, môi trường làm việc thân thiện, cởi mở;<br>-	Học hỏi, tích lũy kinh nghiệm khi làm việc trong các dự án lớn với các khách hàng lớn;<br>-	Được đảm bảo các quyền lợi do Luật Lao động quy định: bảo hiểm xã hội, bảo hiểm y tế, ….<br>-	Được hưởng các chế độ phúc lợi khác theo chính sách của công ty;<br>-	Có cơ hội thăng tiến nhanh dựa trên kết quả công việc.<br><br>Thời gian nhận hồ sơ<br>-	Từ 10/06/2020 đến hết 10/07/2020<br>",https://www.vietnamworks.com/java-core-developers-fresher-den-1-nam-kinh-nghiem-1260010-jd,,,,,,,,,,1,,
